{
  "$schema": "https://json-schema.org/draft/2020-12/schema",
  "$id": "https://tiphys.dev/schemas/phase-declaration.schema.json",
  "title": "Tiphys phase declaration",
  "description": "One document per plan phase, a projection of kernel plan M2 section 3's files-to-touch list, committed to main before the phase branch is created (delivery/plan/phase-declarations/README.md). Read by the scope auditor (M2-P4) from the MERGE BASE of the audited branch, never from the head, so editing the declaration on the audited branch cannot widen the audited scope (kernel plan M2, M2-P4 step 4, the anti-widening property). Shape fixed by M2-P4 step 2. Expressed entirely in the closed keyword set of M2-D-04 (src/gates/validate.ts).",
  "type": "object",
  "additionalProperties": false,
  "required": ["id", "branch", "filesToTouch", "declaredExtras", "citations"],
  "properties": {
    "id": {
      "description": "The phase id as the plan spells it, for example M2-P4.",
      "type": "string",
      "pattern": "^M[0-9]+-P[0-9]+$"
    },
    "branch": {
      "description": "The phase's one governing branch (kernel plan M2 section 3: one phase, one branch, one PR).",
      "type": "string",
      "pattern": "^claude/m[0-9]+-p[0-9]+-.+$"
    },
    "filesToTouch": {
      "description": "Literal paths, or literal directories written with a trailing slash. Never a description (M2R-016): the scope auditor matches these strings exactly or as a directory prefix and does not interpret prose.",
      "type": "array",
      "items": {
        "type": "string"
      }
    },
    "declaredExtras": {
      "description": "Paths this phase is authorized to touch beyond filesToTouch, over and above the two standing pre-authorized extras (test/behaviors.json and this phase's own delivery/work-history/<id>.md), which the auditor adds itself and which never need to be listed here.",
      "type": "array",
      "items": {
        "type": "string"
      }
    },
    "citations": {
      "description": "Requirement, finding, decision or constraint ids the plan cites for this phase (for example R-020, DR-0014, M2-C-6, T-003).",
      "type": "array",
      "items": {
        "type": "string"
      }
    },
    "gateClasses": {
      "description": "DR-0029 part 2a (M4-P14). The kernel requires a PHASE to declare at least one gate in each required CLASS and never says what the command is. THE SHAPE IS DECLARED HERE AND THE SEMANTICS ARE NOT, deliberately: an absent reason on a not-applicable class, or a missing establishing phase on a not-yet-establishable one, must reach a reader as a RED gate naming the phase and the class, and a schema rejection would instead surface as the gate's `error` status, which M2-C-3 reserves for a check that could not reach a verdict. So this property admits every shape src/gates/gate-classes.ts is able to report on, and that module refuses the ones DR-0029 forbids. The property is OPTIONAL because every declaration written before this phase lacks it and a required field would make all of them fail to load, turning a red verdict into an error for a defect this schema is not the right instrument for.",
      "type": "object",
      "additionalProperties": false,
      "properties": {
        "correctness": {
          "$ref": "#/$defs/classDeclaration"
        },
        "scope": {
          "$ref": "#/$defs/classDeclaration"
        },
        "review": {
          "$ref": "#/$defs/classDeclaration"
        }
      }
    }
  },
  "$defs": {
    "classDeclaration": {
      "description": "One class's disposition. EITHER `gates` names one or more gate ids that assert this class, OR `status` declares an escape: `not-applicable` carrying a `reason`, or `not-yet-establishable` carrying `establishedBy`, the phase id that will establish it. DR-0029: a phase may start from nothing and may never SILENTLY have nothing, so the escape is data, it is visible, and it is carried forward.",
      "type": "object",
      "additionalProperties": false,
      "properties": {
        "gates": {
          "description": "Gate ids from this repository's own gate registry that assert this class for this phase.",
          "type": "array",
          "items": {
            "type": "string"
          }
        },
        "status": {
          "description": "The declared escape, when this phase asserts no gate in this class.",
          "type": "string",
          "enum": ["not-applicable", "not-yet-establishable"]
        },
        "reason": {
          "description": "Required by src/gates/gate-classes.ts when status is not-applicable. Not required HERE: an empty or absent reason is a RED verdict naming the class, not a document that fails to load.",
          "type": "string"
        },
        "establishedBy": {
          "description": "Required by src/gates/gate-classes.ts when status is not-yet-establishable: the phase id that will establish this class. The IOU's due date.",
          "type": "string"
        }
      }
    }
  }
}
