{
  "id": "M4-P22",
  "branch": "claude/m4-p22-shared-exclusion-integration",
  "filesToTouch": [
    "src/commands/doctor.ts",
    "src/spawn.ts",
    "src/teardown.ts",
    "src/exclusion.ts",
    "test/doctor.test.ts",
    "test/spawn.test.ts",
    "test/teardown.test.ts",
    "delivery/verification/two-environment-rehearsal.md",
    "witness/"
  ],
  "declaredExtras": [
    "test/behaviors.json",
    "delivery/plan/phase-declarations/m4-p22.json",
    "delivery/work-history/m4-p22.md"
  ],
  "citations": ["DR-0027", "DR-0031", "T-009", "T-032", "C-1", "C-2", "C-3"],
  "gateClasses": {
    "correctness": { "gates": ["suite", "typecheck", "red-witness"] },
    "scope": { "gates": ["scope"] },
    "review": { "gates": ["check-dual-review"] }
  }
}
