{
  "id": "M3-P7",
  "branch": "claude/m3-p7-review-checklists",
  "filesToTouch": [
    "schemas/checklist.schema.json",
    "schemas/verdict.schema.json",
    "checklists/plan-review.yaml",
    "checklists/clean-room.yaml",
    "checklists/flake-playbook.yaml",
    "checklists/env-failure-diagnosis.yaml",
    "checklists/hazard-review.yaml",
    "src/checklists.ts",
    "src/commands/checklist.ts",
    "test/checklists.test.ts",
    "test/verdict-schema.test.ts",
    "test/fixtures/",
    "src/cli.ts",
    "src/validate.ts",
    "src/checks.ts",
    "package.json"
  ],
  "declaredExtras": [],
  "citations": [
    "R-026b",
    "R-027",
    "R-028a",
    "R-050b",
    "R-053",
    "R-054",
    "R-055",
    "R-056a",
    "R-057b",
    "R-059",
    "R-060",
    "R-066",
    "R-093",
    "T-001",
    "T-003",
    "D-M3-26",
    "T-006",
    "T-007",
    "D-M3-32",
    "D-M3-30"
  ]
}
