{
  "id": "M4-P24",
  "branch": "claude/m4-p24-cutover-gaps",
  "filesToTouch": [
    "src/commands/next.ts",
    "src/cli.ts",
    "plugin/src/",
    "test/next.test.ts",
    "witness/"
  ],
  "declaredExtras": [
    "test/behaviors.json",
    "delivery/plan/phase-declarations/m4-p24.json",
    "delivery/work-history/m4-p24.md"
  ],
  "citations": ["DR-0027", "DR-0031", "DR-0040", "DR-0046", "T-009", "T-032", "T-036", "C-1", "C-2", "C-3"],
  "gateClasses": {
    "correctness": { "gates": ["suite", "typecheck", "red-witness"] },
    "scope": { "gates": ["scope"] },
    "review": { "gates": ["check-dual-review"] }
  }
}
