{
  "id": "M5-P2",
  "branch": "claude/m5-p2-intent-to-outcome",
  "filesToTouch": [
    "src/commands/brief.ts",
    "schemas/final-report.schema.json",
    "templates/final-report.example.yaml",
    "roles/implementer.md",
    "roles/clean-room-reviewer.md",
    "test/brief-compose.test.ts",
    "test/report-contract.test.ts",
    "src/charter.ts",
    "src/commands/doctor.ts",
    "roles/README.md",
    "AGENTS.md",
    "witness/"
  ],
  "declaredExtras": [
    "test/behaviors.json",
    "delivery/plan/phase-declarations/m5-p2.json"
  ],
  "citations": [
    "DR-0029",
    "R-018",
    "R-089a"
  ],
  "gateClasses": {
    "correctness": { "gates": ["suite", "typecheck", "red-witness"] },
    "scope": { "gates": ["scope"] },
    "review": { "gates": ["check-dual-review"] }
  }
}
