{
  "id": "M4-P9",
  "branch": "claude/m4-p9-project-write-block",
  "filesToTouch": [
    "plugin/src/hooks/project-write-block.ts",
    "plugin/.claude-plugin/plugin.json",
    "schemas/write-bypass.schema.json",
    "src/commands/validate.ts",
    "test/project-write-block.test.ts",
    "AGENTS.md",
    "witness/"
  ],
  "declaredExtras": [
    "test/behaviors.json",
    "delivery/plan/phase-declarations/m4-p9.json",
    "delivery/work-history/m4-p9.md"
  ],
  "citations": [
    "DR-0027",
    "DR-0031",
    "DR-0040",
    "T-009",
    "T-032",
    "C-1",
    "C-2",
    "C-3"
  ],
  "gateClasses": {
    "correctness": {
      "gates": [
        "suite",
        "typecheck",
        "red-witness"
      ]
    },
    "scope": {
      "gates": [
        "scope"
      ]
    },
    "review": {
      "gates": [
        "check-dual-review"
      ]
    }
  }
}
